{
  "schemaVersion": 1,
  "catalogVersion": "0.8.0",
  "source": "Existing foods plus curated generic additions with USDA FoodData Central, AESAN/BEDCA, and manufacturer nutrition references; qualitative recovery tags use NHS fracture guidance and NIH Office of Dietary Supplements food-source guidance. Version 0.8.0 adds ingredients for Ensalada templada de gulas and updates the generic gulas estimate from the manufacturer's natural product label.",
  "status": "Catálogo 0.8.0; 90 alimentos. Recuperación ósea marcada cualitativamente mediante fuentes de calcio, vitamina D y vitamina C, sin cantidades de micronutrientes.",
  "foods": [
    {
      "id": "skyr",
      "name": "Yogur natural alto en proteínas",
      "recoveryTags": ["calcium"],
      "unit": "g",
      "recipeUnit": "g",
      "nutrition": {
        "basis": "per_100g",
        "kcal": 64,
        "protein_g": 10,
        "carbohydrates_g": 4,
        "fat_g": 0.4
      },
      "purchase": {
        "store": "supermercado",
        "section": "Lácteos y desayuno",
        "quantity": 500,
        "unit": "g",
        "label": "500 g / envase"
      },
      "nutritionSource": "Estimación heredada del catálogo actual de la aplicación; revisar frente a etiquetas de productos reales."
    },
    {
      "id": "greek",
      "name": "Yogur griego natural",
      "recoveryTags": ["calcium"],
      "unit": "g",
      "recipeUnit": "g",
      "nutrition": {
        "basis": "per_100g",
        "kcal": 102,
        "protein_g": 6,
        "carbohydrates_g": 4,
        "fat_g": 6
      },
      "purchase": {
        "store": "supermercado",
        "section": "Lácteos y desayuno",
        "quantity": 500,
        "unit": "g",
        "label": "500 g / envase"
      },
      "nutritionSource": "Estimación heredada del catálogo actual de la aplicación; revisar frente a etiquetas de productos reales."
    },
    {
      "id": "milk",
      "name": "Leche semidesnatada",
      "recoveryTags": ["calcium"],
      "unit": "ml",
      "recipeUnit": "ml",
      "nutrition": {
        "basis": "per_100ml",
        "kcal": 50,
        "protein_g": 3.4,
        "carbohydrates_g": 4.7,
        "fat_g": 1.6
      },
      "purchase": {
        "store": "supermercado",
        "section": "Lácteos y desayuno",
        "quantity": 1000,
        "unit": "ml",
        "label": "tetrabrik de 1 L"
      },
      "nutritionSource": "Estimación heredada del catálogo actual de la aplicación; revisar frente a etiquetas de productos reales."
    },
    {
      "id": "cheese",
      "name": "Queso fresco",
      "recoveryTags": ["calcium"],
      "unit": "g",
      "recipeUnit": "g",
      "nutrition": {
        "basis": "per_100g",
        "kcal": 116,
        "protein_g": 11.5,
        "carbohydrates_g": 3,
        "fat_g": 6
      },
      "purchase": {
        "store": "supermercado",
        "section": "Lácteos y desayuno",
        "quantity": 250,
        "unit": "g",
        "label": "250 g / envase"
      },
      "nutritionSource": "Estimación heredada del catálogo actual de la aplicación; revisar frente a etiquetas de productos reales."
    },
    {
      "id": "granola",
      "name": "Granola sin azúcar añadido",
      "unit": "g",
      "recipeUnit": "g",
      "nutrition": {
        "basis": "per_100g",
        "kcal": 440,
        "protein_g": 10,
        "carbohydrates_g": 60,
        "fat_g": 17
      },
      "purchase": {
        "store": "supermercado",
        "section": "Lácteos y desayuno",
        "quantity": 350,
        "unit": "g",
        "label": "350 g / envase"
      },
      "nutritionSource": "Estimación heredada del catálogo actual de la aplicación; revisar frente a etiquetas de productos reales."
    },
    {
      "id": "oats",
      "name": "Copos de avena",
      "unit": "g",
      "recipeUnit": "g",
      "nutrition": {
        "basis": "per_100g",
        "kcal": 370,
        "protein_g": 13,
        "carbohydrates_g": 59,
        "fat_g": 7
      },
      "purchase": {
        "store": "supermercado",
        "section": "Lácteos y desayuno",
        "quantity": 500,
        "unit": "g",
        "label": "500 g / envase"
      },
      "nutritionSource": "Estimación heredada del catálogo actual de la aplicación; revisar frente a etiquetas de productos reales."
    },
    {
      "id": "bread",
      "name": "Pan integral",
      "unit": "g",
      "recipeUnit": "g",
      "nutrition": {
        "basis": "per_100g",
        "kcal": 250,
        "protein_g": 9,
        "carbohydrates_g": 45,
        "fat_g": 4
      },
      "purchase": {
        "store": "supermercado",
        "section": "Cereales y conservas",
        "quantity": 400,
        "unit": "g",
        "label": "400 g / envase"
      },
      "nutritionSource": "Estimación heredada del catálogo actual de la aplicación; revisar frente a etiquetas de productos reales."
    },
    {
      "id": "rice",
      "name": "Arroz seco",
      "unit": "g",
      "recipeUnit": "g",
      "nutrition": {
        "basis": "per_100g",
        "kcal": 360,
        "protein_g": 7,
        "carbohydrates_g": 78,
        "fat_g": 1
      },
      "purchase": {
        "store": "supermercado",
        "section": "Cereales y conservas",
        "quantity": 1000,
        "unit": "g",
        "label": "1000 g / envase"
      },
      "nutritionSource": "Estimación heredada del catálogo actual de la aplicación; revisar frente a etiquetas de productos reales."
    },
    {
      "id": "pasta",
      "name": "Pasta integral seca",
      "unit": "g",
      "recipeUnit": "g",
      "nutrition": {
        "basis": "per_100g",
        "kcal": 345,
        "protein_g": 13,
        "carbohydrates_g": 68,
        "fat_g": 2
      },
      "purchase": {
        "store": "supermercado",
        "section": "Cereales y conservas",
        "quantity": 500,
        "unit": "g",
        "label": "500 g / envase"
      },
      "nutritionSource": "Estimación heredada del catálogo actual de la aplicación; revisar frente a etiquetas de productos reales."
    },
    {
      "id": "tortilla",
      "name": "Tortilla integral de trigo",
      "unit": "g",
      "recipeUnit": "g",
      "nutrition": {
        "basis": "per_100g",
        "kcal": 295,
        "protein_g": 8,
        "carbohydrates_g": 50,
        "fat_g": 6
      },
      "purchase": {
        "store": "supermercado",
        "section": "Cereales y conservas",
        "quantity": 300,
        "unit": "g",
        "label": "300 g / envase"
      },
      "nutritionSource": "Estimación heredada del catálogo actual de la aplicación; revisar frente a etiquetas de productos reales."
    },
    {
      "id": "eggs",
      "name": "Huevos",
      "recoveryTags": ["vitamin_d"],
      "unit": "ud",
      "recipeUnit": "ud",
      "nutrition": {
        "basis": "per_unit",
        "kcal": 72,
        "protein_g": 6.3,
        "carbohydrates_g": 0.4,
        "fat_g": 5
      },
      "purchase": {
        "store": "supermercado",
        "section": "Carnes, pescado y huevos",
        "quantity": 6,
        "unit": "ud",
        "label": "media docena"
      },
      "nutritionSource": "Estimación heredada del catálogo actual de la aplicación; revisar frente a etiquetas de productos reales."
    },
    {
      "id": "chicken",
      "name": "Pechuga de pollo fresca",
      "unit": "g",
      "recipeUnit": "g",
      "nutrition": {
        "basis": "per_100g",
        "kcal": 110,
        "protein_g": 23,
        "carbohydrates_g": 0,
        "fat_g": 2
      },
      "purchase": {
        "store": "supermercado",
        "section": "Carnes, pescado y huevos",
        "quantity": 500,
        "unit": "g",
        "label": "500 g / envase"
      },
      "nutritionSource": "Estimación heredada del catálogo actual de la aplicación; revisar frente a etiquetas de productos reales."
    },
    {
      "id": "turkey",
      "name": "Filetes de pavo fresco",
      "unit": "g",
      "recipeUnit": "g",
      "nutrition": {
        "basis": "per_100g",
        "kcal": 108,
        "protein_g": 24,
        "carbohydrates_g": 0,
        "fat_g": 1.5
      },
      "purchase": {
        "store": "supermercado",
        "section": "Carnes, pescado y huevos",
        "quantity": 500,
        "unit": "g",
        "label": "500 g / envase"
      },
      "nutritionSource": "Estimación heredada del catálogo actual de la aplicación; revisar frente a etiquetas de productos reales."
    },
    {
      "id": "turkeySlice",
      "name": "Pavo loncheado",
      "unit": "g",
      "recipeUnit": "g",
      "nutrition": {
        "basis": "per_100g",
        "kcal": 103,
        "protein_g": 18,
        "carbohydrates_g": 2.5,
        "fat_g": 2
      },
      "purchase": {
        "store": "supermercado",
        "section": "Carnes, pescado y huevos",
        "quantity": 150,
        "unit": "g",
        "label": "150 g / envase"
      },
      "nutritionSource": "Estimación heredada del catálogo actual de la aplicación; revisar frente a etiquetas de productos reales."
    },
    {
      "id": "hake",
      "name": "Merluza fresca/congelada",
      "unit": "g",
      "recipeUnit": "g",
      "nutrition": {
        "basis": "per_100g",
        "kcal": 82,
        "protein_g": 17,
        "carbohydrates_g": 0,
        "fat_g": 1
      },
      "purchase": {
        "store": "supermercado",
        "section": "Carnes, pescado y huevos",
        "quantity": 400,
        "unit": "g",
        "label": "400 g / envase"
      },
      "nutritionSource": "Estimación heredada del catálogo actual de la aplicación; revisar frente a etiquetas de productos reales."
    },
    {
      "id": "salmon",
      "name": "Salmón",
      "recoveryTags": ["vitamin_d"],
      "unit": "g",
      "recipeUnit": "g",
      "nutrition": {
        "basis": "per_100g",
        "kcal": 205,
        "protein_g": 20,
        "carbohydrates_g": 0,
        "fat_g": 13
      },
      "purchase": {
        "store": "supermercado",